{
  "$schema": "../schema/formation.schema.json",
  "id": "mcvay-11p-condensed-bunch-vs-nickel",
  "name": "Sean McVay Condensed 11 Personnel Bunch Right vs Nickel 4-2-5 (Two-High / Single-High Match)",
  "description": "Tight WR splits and condensed alignments foundational to Duo, Sail, and Crosser concepts.",
  "offense": {
    "C": { "x": 26.67, "y": -0.4, "role": "ol" },
    "LG": { "x": 25, "y": -0.4, "role": "ol" },
    "LT": { "x": 23.3, "y": -0.4, "role": "ol" },
    "RG": { "x": 28.3, "y": -0.4, "role": "ol" },
    "RT": { "x": 30, "y": -0.4, "role": "ol" },
    "QB": { "x": 26.67, "y": -1.8, "role": "qb" },
    "RB": { "x": 26.67, "y": -4.8, "role": "rb" },
    "TE": { "x": 31.8, "y": -0.6, "role": "te" },
    "X": { "x": 10, "y": -0.5, "role": "wr" },
    "H": { "x": 34.5, "y": -1.2, "role": "wr" },
    "Z": { "x": 37, "y": -0.5, "role": "wr" }
  },
  "defense": {
    "WDE": { "x": 21, "y": 0.9, "role": "dl" },
    "NT": { "x": 25.5, "y": 0.9, "role": "dl" },
    "3T": { "x": 29.2, "y": 0.9, "role": "dl" },
    "SDE": { "x": 32.8, "y": 0.9, "role": "dl" },
    "WILL": { "x": 23.5, "y": 4.5, "role": "lb" },
    "MIKE": { "x": 27.5, "y": 4.8, "role": "lb" },
    "NICKEL": { "x": 35, "y": 4, "role": "db" },
    "LCB": { "x": 10, "y": 6.5, "role": "db" },
    "RCB": { "x": 38, "y": 6.5, "role": "db" },
    "SS": { "x": 34, "y": 9.5, "role": "db" },
    "FS": { "x": 25, "y": 13, "role": "db" }
  }
}
