{
  "$schema": "../schema/formation.schema.json",
  "id": "flores-psycho-mug-vs-11p",
  "name": "Brian Flores Psycho 7-Man Mug Front vs 11 Personnel Gun 3x1",
  "offense": {
    "C": { "x": 26.67, "y": -0.4, "role": "ol" },
    "LG": { "x": 25, "y": -0.4, "role": "ol" },
    "LT": { "x": 23.3, "y": -0.4, "role": "ol" },
    "RG": { "x": 28.3, "y": -0.4, "role": "ol" },
    "RT": { "x": 30, "y": -0.4, "role": "ol" },
    "QB": { "x": 26.67, "y": -4.5, "role": "qb" },
    "RB": { "x": 23.5, "y": -4.5, "role": "rb" },
    "X": { "x": 7, "y": -0.5, "role": "wr" },
    "H": { "x": 36.5, "y": -0.8, "role": "wr" },
    "Y": { "x": 41.5, "y": -0.8, "role": "wr" },
    "Z": { "x": 47, "y": -0.5, "role": "wr" }
  },
  "defense": {
    "EDGE_L": { "x": 20, "y": 0.8, "role": "dl" },
    "LB_A1": { "x": 24.5, "y": 0.8, "role": "lb" },
    "LB_A2": { "x": 26, "y": 0.8, "role": "lb" },
    "LB_B1": { "x": 27.5, "y": 0.8, "role": "lb" },
    "LB_B2": { "x": 29, "y": 0.8, "role": "lb" },
    "EDGE_R": { "x": 33, "y": 0.8, "role": "dl" },
    "LURKER": { "x": 26.67, "y": 3.5, "role": "lb" },
    "LCB": { "x": 7, "y": 1.5, "role": "db" },
    "RCB": { "x": 47, "y": 1.5, "role": "db" },
    "SLOT_CB": { "x": 36.5, "y": 1.8, "role": "db" },
    "FS": { "x": 41.5, "y": 2.2, "role": "db" }
  }
}
