{
  "$schema": "../schema/formation.schema.json",
  "id": "mcdaniel-21p-speed-vs-43",
  "name": "Mike McDaniel 21 Personnel Speed Pistol/Gun vs 4-3 Under Front",
  "description": "Features cheat-motion alignment for explosive perimeter leverage.",
  "offense": {
    "C": { "x": 26.67, "y": -0.4, "role": "ol" },
    "LG": { "x": 25, "y": -0.4, "role": "ol" },
    "LT": { "x": 23.3, "y": -0.4, "role": "ol" },
    "RG": { "x": 28.3, "y": -0.4, "role": "ol" },
    "RT": { "x": 30, "y": -0.4, "role": "ol" },
    "QB": { "x": 26.67, "y": -4.5, "role": "qb" },
    "RB": { "x": 26.67, "y": -6.8, "role": "rb" },
    "FB": { "x": 28.8, "y": -2.2, "role": "rb" },
    "TE": { "x": 31.8, "y": -0.6, "role": "te" },
    "X": { "x": 8, "y": -0.5, "role": "wr" },
    "Z": { "x": 42, "y": -1.5, "role": "wr" }
  },
  "defense": {
    "WDE": { "x": 20.5, "y": 0.9, "role": "dl" },
    "NT": { "x": 25.2, "y": 0.9, "role": "dl" },
    "3T": { "x": 29, "y": 0.9, "role": "dl" },
    "SDE": { "x": 33.2, "y": 0.9, "role": "dl" },
    "WILL": { "x": 22.5, "y": 4.5, "role": "lb" },
    "MIKE": { "x": 27, "y": 4.8, "role": "lb" },
    "SAM": { "x": 32.5, "y": 3.8, "role": "lb" },
    "LCB": { "x": 8, "y": 6.5, "role": "db" },
    "RCB": { "x": 42, "y": 6.5, "role": "db" },
    "SS": { "x": 35, "y": 8.5, "role": "db" },
    "FS": { "x": 26.67, "y": 14, "role": "db" }
  }
}
