{
  "$schema": "../schema/formation.schema.json",
  "id": "kelly-10p-tempo-spread-vs-nickel",
  "name": "Chip Kelly 10 Personnel Tempo Gun Spread 2x2 vs Nickel 4-2-5 Two-High",
  "description": "Air Raid spacing at snap-rate tempo: no tight ends, four receivers in a balanced 2x2 (X/H left, Y/Z right) for Mesh, Spot, and Four-Verts takes.",
  "offense": {
    "C": { "x": 26.67, "y": -0.4, "role": "ol" },
    "LG": { "x": 25, "y": -0.4, "role": "ol" },
    "LT": { "x": 23.3, "y": -0.4, "role": "ol" },
    "RG": { "x": 28.3, "y": -0.4, "role": "ol" },
    "RT": { "x": 30, "y": -0.4, "role": "ol" },
    "QB": { "x": 26.67, "y": -5, "role": "qb" },
    "RB": { "x": 23.5, "y": -5, "role": "rb" },
    "X": { "x": 7, "y": -0.5, "role": "wr" },
    "H": { "x": 16.5, "y": -1, "role": "wr" },
    "Y": { "x": 37, "y": -1, "role": "wr" },
    "Z": { "x": 46.5, "y": -0.5, "role": "wr" }
  },
  "defense": {
    "WDE": { "x": 21, "y": 0.9, "role": "dl" },
    "NT": { "x": 25.5, "y": 0.9, "role": "dl" },
    "3T": { "x": 29, "y": 0.9, "role": "dl" },
    "SDE": { "x": 32.8, "y": 0.9, "role": "dl" },
    "WILL": { "x": 23.5, "y": 4.5, "role": "lb" },
    "MIKE": { "x": 28, "y": 4.5, "role": "lb" },
    "NICKEL": { "x": 16.5, "y": 4, "role": "db" },
    "LCB": { "x": 7, "y": 6.5, "role": "db" },
    "RCB": { "x": 46.5, "y": 6.5, "role": "db" },
    "SS": { "x": 34, "y": 12, "role": "db" },
    "FS": { "x": 19.5, "y": 12, "role": "db" }
  }
}
